{
  "Id": "myc_merchant",
  "NumItems": 7,
  "PercentUncommon": 30,
  "PercentRare": 10,
  "Items": [
    {
      "CardId": "mycsporecapmantle",
      "Percent": 100,
      "LootType": "None",
      "LootRarity": "Common",
      "LootMisc": ""
    },
    {
      "CardId": "mycmycelialblade",
      "Percent": 100,
      "LootType": "None",
      "LootRarity": "Common",
      "LootMisc": ""
    },
    {
      "CardId": "mycsymbioticidol",
      "Percent": 100,
      "LootType": "None",
      "LootRarity": "Common",
      "LootMisc": ""
    },
    {
      "CardId": "mycfruitingcrown",
      "Percent": 100,
      "LootType": "None",
      "LootRarity": "Common",
      "LootMisc": ""
    },
    {
      "CardId": "mycrotstaff",
      "Percent": 100,
      "LootType": "None",
      "LootRarity": "Common",
      "LootMisc": ""
    },
    {
      "CardId": "mycthornbloomring",
      "Percent": 100,
      "LootType": "None",
      "LootRarity": "Common",
      "LootMisc": ""
    },
    {
      "CardId": "mycsporepouch",
      "Percent": 100,
      "LootType": "None",
      "LootRarity": "Common",
      "LootMisc": ""
    },
    {
      "CardId": "greaterhealthpotion",
      "Percent": 100,
      "LootType": "None",
      "LootRarity": "Common",
      "LootMisc": ""
    },
    {
      "CardId": "greatermanapotion",
      "Percent": 100,
      "LootType": "None",
      "LootRarity": "Common",
      "LootMisc": ""
    },
    {
      "CardId": "rejuvenationpotion",
      "Percent": 100,
      "LootType": "None",
      "LootRarity": "Common",
      "LootMisc": ""
    },
    {
      "CardId": "berserkpotion",
      "Percent": 100,
      "LootType": "None",
      "LootRarity": "Common",
      "LootMisc": ""
    }
  ]
}